user_name,tweet_body,date,favorite_count,retweet_count,retweeted,source
JimWebbUSA,"RT @nytimes: For Jim Webb, the debate turned into a choice of getting mad or being mute. (He chose mad.) http://t.co/8WG1lAlg7E",Fri Oct 16 04:03:32 +0000 2015,0,72,False,"<a href=""http://twitter.com/download/iphone"" rel=""nofollow"">Twitter for iPhone</a>"
JimWebbUSA,RT @DRUDGE_REPORT: WEBB: Debate Was 'Rigged'... http://t.co/AZC595SB1O,Fri Oct 16 04:03:08 +0000 2015,0,160,False,"<a href=""http://twitter.com/download/iphone"" rel=""nofollow"">Twitter for iPhone</a>"
JimWebbUSA,"RT @RealJamesWoods: Though we differ politically, Jim Webb is a genuine American hero. The Navy Cross is a badge of exemplary courage.  htt…",Fri Oct 16 04:02:44 +0000 2015,0,446,False,"<a href=""http://twitter.com/download/iphone"" rel=""nofollow"">Twitter for iPhone</a>"
JimWebbUSA,RT @chicagotribune: Jim Webb’s son: people criticizing my dad for killing a man in combat are missing the point http://t.co/os0ScYTozu http…,Fri Oct 16 04:02:25 +0000 2015,0,29,False,"<a href=""http://twitter.com/download/iphone"" rel=""nofollow"">Twitter for iPhone</a>"
JimWebbUSA,"RT @Trollin4Liberty: @CBlackTX Honestly, I'd say @JimWebbUSA won that debate. He came in as a nobody and now many more people are talking a…",Fri Oct 16 03:57:27 +0000 2015,0,6,False,"<a href=""http://twitter.com/download/iphone"" rel=""nofollow"">Twitter for iPhone</a>"
JimWebbUSA,RT @RCDefense: A Must-Read Piece of Original Fiction From @JimWebbUSA .... https://t.co/bLrNcgJWpL,Fri Oct 16 02:20:52 +0000 2015,0,6,False,"<a href=""http://twitter.com/download/iphone"" rel=""nofollow"">Twitter for iPhone</a>"
JimWebbUSA,RT @MarkFitz21: @dsandelovsky @JimWebbUSA he is the only one that is moderate enough to unite both parties. We have become way too polarized,Fri Oct 16 01:53:41 +0000 2015,0,7,False,"<a href=""http://twitter.com/download/iphone"" rel=""nofollow"">Twitter for iPhone</a>"
JimWebbUSA,RT @Lawrence: .@TerrysTweets7 @DaBearded0ne Online polls say @JimWebbUSA came in 2nd to @SenSanders,Fri Oct 16 01:53:10 +0000 2015,0,8,False,"<a href=""http://twitter.com/download/iphone"" rel=""nofollow"">Twitter for iPhone</a>"
JimWebbUSA,Jim's son makes poignant observations &amp asks serious questions after #DemDebate http://t.co/qJpVSl8SiK #WebbNation http://t.co/TBWe50vkm6,Fri Oct 16 01:01:02 +0000 2015,53,41,False,"<a href=""http://www.hootsuite.com"" rel=""nofollow"">Hootsuite</a>"
JimWebbUSA,"RT @yocharlieman: @time poll says @JimWebbUSA came 2nd in the #DemDebate . given the time to explain complex issues, he should be 1st! http…",Fri Oct 16 00:47:27 +0000 2015,0,10,False,"<a href=""http://twitter.com"" rel=""nofollow"">Twitter Web Client</a>"
JimWebbUSA,"RT @mab8663Panto: @nicktjacob @JimWebbUSA For example, look at the Slate political editors' tweet during the debate. http://t.co/Fj9yN6lxAd",Fri Oct 16 00:41:06 +0000 2015,0,10,False,"<a href=""http://twitter.com"" rel=""nofollow"">Twitter Web Client</a>"
JimWebbUSA,Jim's son explains what's being missed in discussing his dad's comments: http://t.co/qJpVSkRgUa #WebbNation http://t.co/dgqeecDGSc,Fri Oct 16 00:01:08 +0000 2015,105,79,False,"<a href=""http://www.hootsuite.com"" rel=""nofollow"">Hootsuite</a>"
JimWebbUSA,"RT @RustyWiggs82: @JimWebbUSA Joined Twitter for you, I know many others are will follow suit. You're what America needs! WEBB2016!",Thu Oct 15 23:51:44 +0000 2015,0,2,False,"<a href=""http://twitter.com/download/iphone"" rel=""nofollow"">Twitter for iPhone</a>"
JimWebbUSA,RT @Schmortnie: Liking what @JimWebbUSA has to say so far about military/foreign policy #DemDebate,Thu Oct 15 23:51:21 +0000 2015,0,1,False,"<a href=""http://twitter.com/download/iphone"" rel=""nofollow"">Twitter for iPhone</a>"
JimWebbUSA,"Jim's son, a combat #veteran of the Iraq war, gives one hell of a response... http://t.co/qJpVSkRgUa #WebbNation http://t.co/KONOCSKRh1",Thu Oct 15 23:01:04 +0000 2015,60,41,False,"<a href=""http://www.hootsuite.com"" rel=""nofollow"">Hootsuite</a>"
JimWebbUSA,RT @MatthewFFerraro: .@JimWebbUSA: Very happy to hear you discuss the importance of confronting #China on #OPM #hack @CFR_org. I agree! htt…,Thu Oct 15 22:56:27 +0000 2015,0,4,False,"<a href=""http://twitter.com/download/iphone"" rel=""nofollow"">Twitter for iPhone</a>"
JimWebbUSA,"RT @BrettLinley: Just when I thought I had no one to vote for on either side, @JimWebbUSA comes through in the clutch #POTUS2016",Thu Oct 15 22:55:13 +0000 2015,0,7,False,"<a href=""http://twitter.com/download/iphone"" rel=""nofollow"">Twitter for iPhone</a>"
JimWebbUSA,RT @WeAreTheMighty: That time @JimWebbUSA killed a guy who threw a grenade at him http://t.co/N2yIWKSY3r #RAH http://t.co/6X1RP2N300,Thu Oct 15 22:46:59 +0000 2015,0,23,False,"<a href=""http://twitter.com/download/iphone"" rel=""nofollow"">Twitter for iPhone</a>"
JimWebbUSA,RT @jcrsaltman: @JimWebbUSA Am a staunch Webb supporter. Glad for the positive reviews that have emerged. More needs to be done :exposure e…,Thu Oct 15 22:38:33 +0000 2015,0,13,False,"<a href=""http://twitter.com/download/iphone"" rel=""nofollow"">Twitter for iPhone</a>"
JimWebbUSA,null,null,null,null,null,null
JimWebbUSA,null,null,null,null,null,null
JebBush,"Fred Thompson lived an amazing life, he will be sorely missed. Columba and my prayers are with Jeri and his his kids &amp grandkids",Sun Nov 01 23:08:52 +0000 2015,193,101,False,"<a href=""http://twitter.com/download/iphone"" rel=""nofollow"">Twitter for iPhone</a>"
JebBush,"We need a president who is a public servant at heart.
https://t.co/yY69Yfj7q0",Sun Nov 01 22:46:28 +0000 2015,90,42,False,"<a href=""http://twitter.com"" rel=""nofollow"">Twitter Web Client</a>"
JebBush,I hope you’ll join me for a rally in Tampa tomorrow. RSVP here: https://t.co/oAxr5Q2Nrm https://t.co/76kgDMRC03,Sun Nov 01 21:32:55 +0000 2015,74,38,False,"<a href=""http://twitter.com"" rel=""nofollow"">Twitter Web Client</a>"
JebBush,Reunited with the Punta Gorda community at Charlotte High School football game on Friday. https://t.co/0lRCnpGixc,Sun Nov 01 20:19:08 +0000 2015,80,35,False,"<a href=""http://twitter.com"" rel=""nofollow"">Twitter Web Client</a>"
JebBush,"The challenges of running for president are nothing compared to being president, and I'm fighting for both.
https://t.co/g3C0dbY55J",Sun Nov 01 18:43:46 +0000 2015,92,45,False,"<a href=""http://twitter.com"" rel=""nofollow"">Twitter Web Client</a>"
JebBush,"My record as a conservative reformer is a clear contrast to @HillaryClinton’s record of no accomplishments.
https://t.co/zcl3YvEQ4u",Sun Nov 01 16:34:10 +0000 2015,101,65,False,"<a href=""http://twitter.com"" rel=""nofollow"">Twitter Web Client</a>"
JebBush,"We can’t just give up &amp settle for gridlock in Washington. I’m running for president because I know I can fix it.
https://t.co/mC16thGD1p",Sun Nov 01 15:09:47 +0000 2015,127,71,False,"<a href=""http://twitter.com"" rel=""nofollow"">Twitter Web Client</a>"
JebBush,Have a safe and happy Halloween! TBD on whether I bring back the NASCAR costume from 2003 tonight. https://t.co/Q6tbnk7E8N,Sat Oct 31 20:14:21 +0000 2015,287,94,False,"<a href=""http://twitter.com"" rel=""nofollow"">Twitter Web Client</a>"
JebBush,"The glue that ""helped bring our community back together.""
https://t.co/Z0Bm8OJvl3",Sat Oct 31 17:33:24 +0000 2015,37,33,False,"<a href=""http://twitter.com"" rel=""nofollow"">Twitter Web Client</a>"
JebBush,Brought @chucktodd back to his hometown to talk 2016. Awesome view. Tune in tomorrow. https://t.co/spnwsPpd9p,Sat Oct 31 16:11:43 +0000 2015,112,85,False,"<a href=""http://twitter.com/download/iphone"" rel=""nofollow"">Twitter for iPhone</a>"
JebBush,"2 teams, 1 fierce rivalry &amp the hurricane that brought them together. Still inspired by this community's strength. https://t.co/qmub4yxocr",Sat Oct 31 15:39:32 +0000 2015,38,21,False,"<a href=""http://twitter.com"" rel=""nofollow"">Twitter Web Client</a>"
JebBush,Had a great time at the @WMUR9 candidate cafe yesterday in New Hampshire. Thanks for having me @JoshMcElveen #FITN https://t.co/iL01NR7qmu,Sat Oct 31 13:55:54 +0000 2015,81,38,False,"<a href=""http://twitter.com"" rel=""nofollow"">Twitter Web Client</a>"
JebBush,Friday Night Lights https://t.co/buZD2xsSR9,Sat Oct 31 01:04:05 +0000 2015,325,184,False,"<a href=""http://twitter.com/download/iphone"" rel=""nofollow"">Twitter for iPhone</a>"
JebBush,Tailgate time at Charlotte High School. Reuniting with a community devastated by Hurricane Charley 11 years ago. https://t.co/Pi7TndqY92,Fri Oct 30 23:04:18 +0000 2015,148,73,False,"<a href=""http://twitter.com"" rel=""nofollow"">Twitter Web Client</a>"
JebBush,"This is what public service is all about — supporting communities in need and bringing people together.
https://t.co/ZGBzZIciNE",Fri Oct 30 21:05:48 +0000 2015,93,68,False,"<a href=""http://twitter.com"" rel=""nofollow"">Twitter Web Client</a>"
JebBush,Performing the opening coin toss at the “Hurricane Bowl” was one of the highlights of my life. Here’s why: https://t.co/3uKjHCvtwB,Fri Oct 30 20:17:47 +0000 2015,51,32,False,"<a href=""http://twitter.com"" rel=""nofollow"">Twitter Web Client</a>"
JebBush,“We just had such a sense of assurance in our leadership..I haven’t felt that assurance since in any govt officials” https://t.co/RgDtkgd6kc,Fri Oct 30 19:14:03 +0000 2015,44,25,False,"<a href=""http://twitter.com"" rel=""nofollow"">Twitter Web Client</a>"
JebBush,"11 yrs ago today we celebrated communities divided by a river, united by a storm. Excited to tailgate there tonight. https://t.co/gjNH3o6n5w",Fri Oct 30 18:22:42 +0000 2015,111,48,False,"<a href=""http://twitter.com"" rel=""nofollow"">Twitter Web Client</a>"
JebBush,"A story of how decisive, hands-on, committed leadership can unite in times of crisis &amp heal broken communities: https://t.co/R2fv69Vk6I",Fri Oct 30 17:33:26 +0000 2015,41,46,False,"<a href=""http://twitter.com"" rel=""nofollow"">Twitter Web Client</a>"
JebBush,"Last night in NH, I talked about how we need to apply conservative principles &amp start fixing complex issues.
https://t.co/B20fStWl8g",Fri Oct 30 16:08:32 +0000 2015,64,51,False,"<a href=""http://twitter.com"" rel=""nofollow"">Twitter Web Client</a>"
JebBush,"Thanks to the college students who joined our endorsement rally with Sen. Judd Gregg in Portsmouth, NH. https://t.co/4CfDaEmxmV",Fri Oct 30 15:12:27 +0000 2015,121,46,False,"<a href=""http://twitter.com"" rel=""nofollow"">Twitter Web Client</a>"
JebBush,"I have a proven record of achieving conservative reforms &amp I’m taking that message to IA, NH &amp beyond. Join me: https://t.co/e9BbkSziBP",Fri Oct 30 14:07:08 +0000 2015,76,41,False,"<a href=""http://twitter.com"" rel=""nofollow"">Twitter Web Client</a>"
JebBush,"Thanks for coming out! 
https://t.co/gGcePYzu4r",Fri Oct 30 13:10:17 +0000 2015,51,26,False,"<a href=""http://twitter.com"" rel=""nofollow"">Twitter Web Client</a>"
JebBush,"Awesome crowd tonight! Great reception to my record of results in FL: 1.3 million new jobs, $19 billion in tax cuts. https://t.co/PgjNhPJKiE",Fri Oct 30 01:03:21 +0000 2015,187,90,False,"<a href=""http://twitter.com"" rel=""nofollow"">Twitter Web Client</a>"
JebBush,Real issue w/fantasy football is when your best player scores against your home team. I want #Gronk to have 5 TDs only if Tannehill gets 6.,Fri Oct 30 00:45:43 +0000 2015,241,117,False,"<a href=""http://twitter.com"" rel=""nofollow"">Twitter Web Client</a>"
JebBush,“I hope you want someone with a servant's heart going to DC. Someone who can actually fix the things that are broken.” - Jeb in NH,Thu Oct 29 23:35:04 +0000 2015,157,73,False,"<a href=""http://twitter.com"" rel=""nofollow"">Twitter Web Client</a>"
JebBush,"Under my leadership, FL earned its AAA credit rating for 1st time. Contrast that with failed Obama/Clinton record. https://t.co/f1sarqkxak",Thu Oct 29 22:39:02 +0000 2015,148,92,False,"<a href=""http://twitter.com"" rel=""nofollow"">Twitter Web Client</a>"
JebBush,"Stark contrast between my record as a conservative reformer &amp @HillaryClinton’s lack of accomplishments.
https://t.co/d9aTIWJaZi",Thu Oct 29 21:40:08 +0000 2015,98,64,False,"<a href=""http://twitter.com"" rel=""nofollow"">Twitter Web Client</a>"
JebBush,"Next stop: New London, NH. Swing by my town hall at 7:00 pm —&gt https://t.co/gNvjkY7rQW",Thu Oct 29 20:39:44 +0000 2015,39,20,False,"<a href=""http://twitter.com"" rel=""nofollow"">Twitter Web Client</a>"
JebBush,Couldn’t ask for a more beautiful day on the trail here in New Hampshire. https://t.co/BQOfsLTuRM,Thu Oct 29 19:45:25 +0000 2015,110,35,False,"<a href=""https://about.twitter.com/products/tweetdeck"" rel=""nofollow"">TweetDeck</a>"
JebBush,"It’s an honor to welcome former New Hampshire Senator Judd Gregg to our team today.
https://t.co/RePY5P5sTL",Thu Oct 29 18:57:09 +0000 2015,78,54,False,"<a href=""http://twitter.com"" rel=""nofollow"">Twitter Web Client</a>"
JebBush,1.3 mil new jobs. $19 bil in tax relief. $2 bil in spending cuts. That’s the message I’m sharing in NH today. https://t.co/kfTPcBnvRH,Thu Oct 29 17:15:09 +0000 2015,79,55,False,"<a href=""https://about.twitter.com/products/tweetdeck"" rel=""nofollow"">TweetDeck</a>"
JebBush,Big congrats to @SpeakerRyan – someone who I am confident will lead on conservative reforms that make a difference for all Americans.,Thu Oct 29 15:41:51 +0000 2015,266,110,False,"<a href=""http://twitter.com"" rel=""nofollow"">Twitter Web Client</a>"
JebBush,"I’ll be in Portsmouth, NH for a town hall this afternoon and it’s not too late to RSVP: https://t.co/Aqr9psy9tw",Thu Oct 29 15:15:24 +0000 2015,36,28,False,"<a href=""http://twitter.com"" rel=""nofollow"">Twitter Web Client</a>"
JebBush,Back on the trail in New Hampshire today telling my story of conservative reform &amp delivering results. Join me: https://t.co/WVsS2bYADO,Thu Oct 29 13:44:50 +0000 2015,67,42,False,"<a href=""http://twitter.com"" rel=""nofollow"">Twitter Web Client</a>"
JebBush,"Jeb's record speaks for itself. #GOPDebate
https://t.co/MT7se44aAF",Thu Oct 29 03:00:55 +0000 2015,163,111,False,"<a href=""http://twitter.com"" rel=""nofollow"">Twitter Web Client</a>"
JebBush,"Families like Rhonda's, who will use the money saved from Jeb's tax plan to pay for her daughter's education. https://t.co/xL7OJrGao6",Thu Oct 29 02:44:27 +0000 2015,51,41,False,"<a href=""http://twitter.com"" rel=""nofollow"">Twitter Web Client</a>"
JebBush,Jeb's tax plan will help families that are struggling to make ends meet: https://t.co/BGC1x5imBC,Thu Oct 29 02:42:44 +0000 2015,61,42,False,"<a href=""http://twitter.com"" rel=""nofollow"">Twitter Web Client</a>"
JebBush,Jeb proved once again he’s the only candidate with the leadership and record to fix DC. Join the team: https://t.co/5uXnGK9nu6,Thu Oct 29 02:35:31 +0000 2015,102,50,False,"<a href=""http://twitter.com"" rel=""nofollow"">Twitter Web Client</a>"
JebBush,Jeb: America is at a crossroads. The DC politicians continue to make things worse. I have a proven record of success. #GOPDebate,Thu Oct 29 02:20:09 +0000 2015,138,72,False,"<a href=""http://twitter.com"" rel=""nofollow"">Twitter Web Client</a>"
JebBush,We don’t need to settle for the Democrats' “new normal” of slow growth. We can fix this. #GOPDebate https://t.co/958UNFADen,Thu Oct 29 02:14:36 +0000 2015,184,99,False,"<a href=""http://twitter.com"" rel=""nofollow"">Twitter Web Client</a>"
JebBush,Learn about Jeb's plan to preserve &amp protect Medicare &amp Social Security for future generations: https://t.co/LFL6qDRPRD #GOPDebate,Thu Oct 29 02:09:51 +0000 2015,78,51,False,"<a href=""http://twitter.com"" rel=""nofollow"">Twitter Web Client</a>"
JebBush,We need to get Washington out of the way so that every American has the opportunity to rise up. #GOPDebate https://t.co/yC6cBrn8XI,Thu Oct 29 02:03:17 +0000 2015,142,100,False,"<a href=""http://twitter.com"" rel=""nofollow"">Twitter Web Client</a>"
JebBush,Jeb: It's always the solution from the left to create more government. It's broken and it isn't working. #GOPDebate,Thu Oct 29 01:56:27 +0000 2015,212,118,False,"<a href=""http://twitter.com"" rel=""nofollow"">Twitter Web Client</a>"
JebBush,"""Elect me so I can fight for the American people."" - Jeb #GOPDebate https://t.co/Os9qhce7x3",Thu Oct 29 01:48:34 +0000 2015,92,62,False,"<a href=""http://twitter.com"" rel=""nofollow"">Twitter Web Client</a>"
JebBush,Here's how Reagan from South Carolina would benefit from Jeb's tax plan. #GOPDebate https://t.co/RcwGFAD77r,Thu Oct 29 01:37:21 +0000 2015,47,47,False,"<a href=""http://twitter.com"" rel=""nofollow"">Twitter Web Client</a>"
JebBush,"""The simple fact is that my plan actually gives the middle-class the greatest break."" - Jeb #GOPDebate",Thu Oct 29 01:35:05 +0000 2015,126,100,False,"<a href=""http://twitter.com"" rel=""nofollow"">Twitter Web Client</a>"
JebBush,"Let’s face it, Washington is broken. We need a problem-solver like Jeb with a record of results. #GOPDebate https://t.co/AJsTtIsFkN",Thu Oct 29 01:33:06 +0000 2015,117,93,False,"<a href=""http://twitter.com"" rel=""nofollow"">Twitter Web Client</a>"
JebBush,Anyone find a Democrat that's for cutting spending $10 yet? #GOPDebate https://t.co/6ZfzkI7gmy,Thu Oct 29 01:26:23 +0000 2015,96,63,False,"<a href=""http://twitter.com"" rel=""nofollow"">Twitter Web Client</a>"
JebBush,Jeb: You don’t have to guess if I’ll cut taxes. I have a record. #GOPDebate https://t.co/yuzD3yZHFl,Thu Oct 29 01:21:23 +0000 2015,77,53,False,"<a href=""http://twitter.com"" rel=""nofollow"">Twitter Web Client</a>"
JebBush,The Obama/Clinton agenda has failed. We need conservative policies &amp Jeb’s the only one who can deliver. #GOPDebate https://t.co/Vh6eUrKcUf,Thu Oct 29 01:05:51 +0000 2015,141,98,False,"<a href=""http://twitter.com"" rel=""nofollow"">Twitter Web Client</a>"
JebBush,French Work Week vs. Real Accomplishments. #GOPDebate https://t.co/24yQ2bMGmF,Thu Oct 29 01:00:26 +0000 2015,64,103,False,"<a href=""http://twitter.com"" rel=""nofollow"">Twitter Web Client</a>"
JebBush,"To see the policies Jeb just laid out, visit https://t.co/JfcZU1YxlP #GOPDebate",Thu Oct 29 00:47:50 +0000 2015,56,51,False,"<a href=""http://twitter.com"" rel=""nofollow"">Twitter Web Client</a>"
JebBush,We have enough talkers in DC. We need a proven leader who can get the job done. #GOPDebate https://t.co/jDdsiD2wtX,Thu Oct 29 00:41:47 +0000 2015,115,101,False,"<a href=""http://twitter.com"" rel=""nofollow"">Twitter Web Client</a>"
JebBush,"Jeb's detailed tax plan puts $2,000 back in the pockets of the average middle-class family. https://t.co/BGC1x5imBC",Thu Oct 29 00:36:15 +0000 2015,104,74,False,"<a href=""http://twitter.com"" rel=""nofollow"">Twitter Web Client</a>"
JebBush,Jeb has a clear plan &amp conservative vision to reform Washington &amp jumpstart the anemic Obama economy. #GOPDebate https://t.co/oqCvc27R22,Thu Oct 29 00:28:06 +0000 2015,97,73,False,"<a href=""http://twitter.com"" rel=""nofollow"">Twitter Web Client</a>"
JebBush,Got my debating boots on! #GOPDebate https://t.co/NdMyEmkT42,Thu Oct 29 00:06:32 +0000 2015,2129,1417,False,"<a href=""http://twitter.com"" rel=""nofollow"">Twitter Web Client</a>"
JebBush,Join us and follow along for tonight’s #GOPDebate here —&gt https://t.co/LzKGbrN7r1,Thu Oct 29 00:01:51 +0000 2015,42,25,False,"<a href=""http://twitter.com"" rel=""nofollow"">Twitter Web Client</a>"
JebBush,Handing my feed over to @Timodc @kristymcampbell @DannyLopezDiaz @sallybradshaw @aebrandenburger @embena @CGeorgia @QuentinCantu #GOPDebate,Wed Oct 28 23:36:04 +0000 2015,56,21,False,"<a href=""http://twitter.com"" rel=""nofollow"">Twitter Web Client</a>"
JebBush,"We can’t afford four more years of the failed Obama-Clinton agenda. #GOPDebate
https://t.co/roJCylhDFJ",Wed Oct 28 23:29:29 +0000 2015,150,92,False,"<a href=""http://twitter.com"" rel=""nofollow"">Twitter Web Client</a>"
JebBush,"Before I take the stage for tonight’s #GOPDebate, chip in $1 to let me know you’re with me: https://t.co/yUKRkAhGe4",Wed Oct 28 23:06:36 +0000 2015,64,34,False,"<a href=""http://twitter.com"" rel=""nofollow"">Twitter Web Client</a>"
JebBush,"This is why I’m running for president. #GOPDebate
https://t.co/Nhw3OFX3e7",Wed Oct 28 22:39:06 +0000 2015,115,92,False,"<a href=""http://twitter.com"" rel=""nofollow"">Twitter Web Client</a>"
JebBush,"There’s a lot of people talking and they’re pretty good at it. We need to start fixing things.
https://t.co/BHCd61W8rX",Wed Oct 28 22:04:27 +0000 2015,88,51,False,"<a href=""http://twitter.com"" rel=""nofollow"">Twitter Web Client</a>"
JebBush,Checking out my podium for tonight’s #GOPDebate. Only a few more hours to go! https://t.co/0J89GTdKSr,Wed Oct 28 20:26:43 +0000 2015,206,98,False,"<a href=""http://twitter.com"" rel=""nofollow"">Twitter Web Client</a>"
JebBush,"If you’re on my team for tonight’s #GOPDebate, add your name &amp let me know here —&gt https://t.co/MbbI2riyBu",Wed Oct 28 19:39:14 +0000 2015,66,40,False,"<a href=""http://twitter.com"" rel=""nofollow"">Twitter Web Client</a>"
JebBush,"After tonight’s #GOPDebate, it’s back to New Hampshire tomorrow. RSVP for an event near you: https://t.co/jeWyhsaoyI https://t.co/htyaG1P0Zq",Wed Oct 28 18:46:55 +0000 2015,44,34,False,"<a href=""http://twitter.com"" rel=""nofollow"">Twitter Web Client</a>"
JebBush,"We need proven, tested leadership of delivering conservative reforms. I did it in FL, I’ll do it in DC. #GOPDebate
https://t.co/7vAgFUwzBY",Wed Oct 28 17:32:12 +0000 2015,90,75,False,"<a href=""http://twitter.com"" rel=""nofollow"">Twitter Web Client</a>"
JebBush,"Higher taxes. Big government. Failed leadership abroad. That’s @HillaryClinton’s agenda in a nutshell. #GOPDebate
https://t.co/Pk2UnKGghJ",Wed Oct 28 16:30:42 +0000 2015,119,100,False,"<a href=""http://twitter.com"" rel=""nofollow"">Twitter Web Client</a>"
JebBush,"My record: 8 balanced budgets. 8 years of tax cuts. $8 billion in new budget reserves. #GOPDebate
https://t.co/yPkccGzE0Y",Wed Oct 28 15:32:25 +0000 2015,92,65,False,"<a href=""http://twitter.com"" rel=""nofollow"">Twitter Web Client</a>"
JebBush,"It’s outrageous for @HillaryClinton to dismiss ongoing problems at the incompetent VA. Our veterans deserve better.
https://t.co/75wIBNQk2o",Wed Oct 28 14:18:11 +0000 2015,123,80,False,"<a href=""http://twitter.com"" rel=""nofollow"">Twitter Web Client</a>"
JebBush,"Clear contrast between my record as a conservative reformer &amp @HillaryClinton &amp @BarackObama’s record of failure.
https://t.co/FEXUYBJ5tq",Wed Oct 28 12:51:17 +0000 2015,102,81,False,"<a href=""http://twitter.com"" rel=""nofollow"">Twitter Web Client</a>"
JebBush,"Get a behind the scenes look at my time as governor &amp a preview of my upcoming e-book, Reply All: https://t.co/gSVhVD21we",Wed Oct 28 00:44:06 +0000 2015,61,40,False,"<a href=""https://about.twitter.com/products/tweetdeck"" rel=""nofollow"">TweetDeck</a>"
JebBush,"My goal as governor was to make Florida a better place to live, work &amp raise a family. We made every minute count.
https://t.co/ADNbIOOvhD",Tue Oct 27 23:00:32 +0000 2015,125,64,False,"<a href=""http://twitter.com"" rel=""nofollow"">Twitter Web Client</a>"
JebBush,I have a proven record of fixing programs like Medicaid. Solving this problem involves an honest conversation: https://t.co/57f0wnxXOi,Tue Oct 27 21:21:04 +0000 2015,82,55,False,"<a href=""http://twitter.com"" rel=""nofollow"">Twitter Web Client</a>"
JebBush,"As Gov, I gave out my email address &amp told the people of FL to use it. Needless to say, my inbox was pretty full.
https://t.co/Aj2sfGmK1X",Tue Oct 27 19:28:24 +0000 2015,132,99,False,"<a href=""http://twitter.com"" rel=""nofollow"">Twitter Web Client</a>"
JebBush,Honored to have the support of a tireless advocate for fiscal responsibility &amp entitlement reform — Alan Simpson. https://t.co/ZRAsPozLM2,Tue Oct 27 18:33:06 +0000 2015,72,47,False,"<a href=""http://twitter.com"" rel=""nofollow"">Twitter Web Client</a>"
JebBush,The best way to prepare for the #GOPDebate: A morning hike at Eldorado Canyon State Park with veterans. https://t.co/JOCpvvF1C6,Tue Oct 27 17:27:35 +0000 2015,164,77,False,"<a href=""http://twitter.com"" rel=""nofollow"">Twitter Web Client</a>"
JebBush,Hillary denying the VA has a problem is an insult to our vets. We need to make fixing the VA a priority and I plan to do just that.,Tue Oct 27 16:51:23 +0000 2015,263,129,False,"<a href=""http://twitter.com"" rel=""nofollow"">Twitter Web Client</a>"
JebBush,The status-quo isn’t sustainable. It’s time to stop kicking the can down the road &amp fix entitlement programs. https://t.co/57f0wnxXOi,Tue Oct 27 15:57:41 +0000 2015,78,60,False,"<a href=""http://twitter.com"" rel=""nofollow"">Twitter Web Client</a>"
JebBush,"Today I’m announcing my plan to preserve, protect &amp reform Medicare &amp Social Security: https://t.co/AmEtHnKioQ",Tue Oct 27 14:43:21 +0000 2015,101,79,False,"<a href=""http://twitter.com"" rel=""nofollow"">Twitter Web Client</a>"
JebBush,Return of Ex-Im w/o real reform is return to bad policy of DC picking winners &amp losers. I'll end it.,Tue Oct 27 00:53:04 +0000 2015,88,63,False,"<a href=""http://twitter.com/download/iphone"" rel=""nofollow"">Twitter for iPhone</a>"
JebBush,Public service is about making a difference in people’s lives. That's what we did in FL: https://t.co/xZz59VzfkV https://t.co/D6drjjhZMz,Tue Oct 27 00:02:44 +0000 2015,135,68,False,"<a href=""http://twitter.com"" rel=""nofollow"">Twitter Web Client</a>"
JebBush,Heading back to the Granite State this week. Join the team —&gt https://t.co/wBaNt4WuLp https://t.co/3BT9xy2h38,Mon Oct 26 22:09:19 +0000 2015,90,41,False,"<a href=""http://twitter.com"" rel=""nofollow"">Twitter Web Client</a>"
