user_name,tweet_body,date,favorite_count,retweet_count,retweeted,source
CarlyFiorina,Thanks for joining me tonight! We’re streaming live now. #CarlyLive https://t.co/xBzt67iA0n,Thu Dec 03 01:10:10 +0000 2015,94,41,False,"<a href=""http://snappytv.com"" rel=""nofollow"">SnappyTV.com</a>"
CarlyFiorina,Questions for Carly? She’s LIVE RIGHT NOW. Watch now at https://t.co/3JH1hG6MLY. #CarlyLive https://t.co/ANzWPQN5gT,Thu Dec 03 01:01:03 +0000 2015,61,47,False,"<a href=""https://about.twitter.com/products/tweetdeck"" rel=""nofollow"">TweetDeck</a>"
CarlyFiorina,LIVE on #Periscope: Carly answers YOUR questions directly. https://t.co/lN1eu13Y2L,Thu Dec 03 01:00:27 +0000 2015,33,25,False,"<a href=""https://periscope.tv"" rel=""nofollow"">Periscope</a>"
CarlyFiorina,.@ladyliberty1215 wants to know how I'll tackle student loan debt. #CarlyLive https://t.co/IZvSb263dR,Thu Dec 03 00:57:28 +0000 2015,83,47,False,"<a href=""http://twitter.com"" rel=""nofollow"">Twitter QandA</a>"
CarlyFiorina,.@MartinRSullivan asks why I support zero-based budgeting. Here's why: #CarlyLive https://t.co/TPe50L8xK2,Thu Dec 03 00:53:54 +0000 2015,71,34,False,"<a href=""http://twitter.com"" rel=""nofollow"">Twitter QandA</a>"
CarlyFiorina,.@nthn_rich asks if using technology will be an important part of my administration. Here's my answer: #CarlyLive https://t.co/1Kwec7qmSZ,Thu Dec 03 00:52:04 +0000 2015,78,33,False,"<a href=""http://twitter.com"" rel=""nofollow"">Twitter QandA</a>"
CarlyFiorina,I'm at @twitter and about to answer some of your questions! #CarlyLive,Thu Dec 03 00:39:10 +0000 2015,146,97,False,"<a href=""https://about.twitter.com/products/tweetdeck"" rel=""nofollow"">TweetDeck</a>"
CarlyFiorina,"Tweet me your questions! I'll be LIVE on Twitter, tonight at 8pm ET, to answer your questions. #CarlyLive https://t.co/CRpKe6ALLX",Wed Dec 02 18:13:39 +0000 2015,96,48,False,"<a href=""https://about.twitter.com/products/tweetdeck"" rel=""nofollow"">TweetDeck</a>"
CarlyFiorina,Questions for Carly? RSVP to join her live online event tonight 8pm ET. https://t.co/p5x0fJJfd3 #CarlyLive,Wed Dec 02 16:00:28 +0000 2015,38,18,False,"<a href=""https://ads.twitter.com"" rel=""nofollow"">Twitter Ads</a>"
CarlyFiorina,"Tweet me your questions! I'll be LIVE on Twitter, tonight at 8pm ET, to answer your questions. #CarlyLive https://t.co/tTpPDUuOvW",Wed Dec 02 14:59:29 +0000 2015,58,38,False,"<a href=""https://about.twitter.com/products/tweetdeck"" rel=""nofollow"">TweetDeck</a>"
CarlyFiorina,"Tweet me your questions! I'll be LIVE on Twitter, tomorrow night at 8pm ET, to answer your questions. #CarlyLive https://t.co/SvK5aHbE8T",Wed Dec 02 02:30:10 +0000 2015,106,63,False,"<a href=""https://about.twitter.com/products/tweetdeck"" rel=""nofollow"">TweetDeck</a>"
CarlyFiorina,Tonight around 9:20 ET I'm joining Megyn Kelly on Fox News. Hope you'll tune in!,Wed Dec 02 01:30:12 +0000 2015,162,50,False,"<a href=""https://about.twitter.com/products/tweetdeck"" rel=""nofollow"">TweetDeck</a>"
CarlyFiorina,Questions for Carly? RSVP now to join her live tomorrow night at 8pm ET. https://t.co/p5x0fJJfd3 #CarlyLive,Wed Dec 02 00:35:19 +0000 2015,45,18,False,"<a href=""https://ads.twitter.com"" rel=""nofollow"">Twitter Ads</a>"
CarlyFiorina,"Tweet me your questions! I'll be LIVE on Twitter, December 2 at 8pm ET, to answer your questions. #CarlyLive https://t.co/b2237EomMi",Tue Dec 01 19:59:51 +0000 2015,121,54,False,"<a href=""http://twitter.com"" rel=""nofollow"">Twitter Web Client</a>"
CarlyFiorina,Questions for Carly? RSVP now to join her live online on Dec. 2 at 8pm ET: https://t.co/qqq0JqDEjH #CarlyLive,Tue Dec 01 15:29:56 +0000 2015,38,20,False,"<a href=""https://ads.twitter.com"" rel=""nofollow"">Twitter Ads</a>"
CarlyFiorina,"Q: Why do we need to move to a 3-page tax code?

Get more answers at https://t.co/sIWIyxiodv.
https://t.co/NvedEK3srJ",Tue Dec 01 01:46:27 +0000 2015,244,134,False,"<a href=""http://twitter.com"" rel=""nofollow"">Twitter Web Client</a>"
CarlyFiorina,Join me Wed. at 8pm ET for a video Q&ampA broadcast live on social media &amp hosted by @twitter in NYC. RSVP: https://t.co/p5x0fJJfd3 #CarlyLive,Mon Nov 30 22:18:23 +0000 2015,94,73,False,"<a href=""https://ads.twitter.com"" rel=""nofollow"">Twitter Ads</a>"
CarlyFiorina,"Tweet me your questions! I'll be LIVE on Twitter, December 2 at 8pm ET, to answer your questions. #CarlyLive https://t.co/b7JUM7NUvc",Mon Nov 30 16:41:39 +0000 2015,155,76,False,"<a href=""https://about.twitter.com/products/tweetdeck"" rel=""nofollow"">TweetDeck</a>"
CarlyFiorina,Questions for Carly? RSVP now to join her live online on Dec. 2 at 8pm ET: https://t.co/qqq0JqDEjH #CarlyLive,Mon Nov 30 13:47:19 +0000 2015,52,28,False,"<a href=""https://ads.twitter.com"" rel=""nofollow"">Twitter Ads</a>"
CarlyFiorina,Questions for Carly? RSVP now to join her live online on Dec. 2 at 8pm ET: https://t.co/qqq0JqDEjH,Sun Nov 29 00:00:14 +0000 2015,107,81,False,"<a href=""https://ads.twitter.com"" rel=""nofollow"">Twitter Ads</a>"
CarlyFiorina,Want to see Carly live? Follow her Periscope: https://t.co/yLxdsJnyYz https://t.co/wrI4FtPOAT,Sat Nov 28 18:40:06 +0000 2015,172,57,False,"<a href=""https://about.twitter.com/products/tweetdeck"" rel=""nofollow"">TweetDeck</a>"
CarlyFiorina,https://t.co/EiPWa9KFrq,Thu Nov 26 13:30:31 +0000 2015,954,379,False,"<a href=""https://about.twitter.com/products/tweetdeck"" rel=""nofollow"">TweetDeck</a>"
CarlyFiorina,"Q: How would you respond to President Obama's deal with Iran? 

Get more answers at https://t.co/sIWIyxiodv.
https://t.co/MzgOnhJese",Wed Nov 25 15:13:14 +0000 2015,169,95,False,"<a href=""http://twitter.com"" rel=""nofollow"">Twitter Web Client</a>"
CarlyFiorina,"Q: Do you find Obama's comments about Republicans objectionable? 

Get more answers at https://t.co/sIWIyxiodv.
https://t.co/U0CYqqn1KA",Tue Nov 24 14:58:43 +0000 2015,205,106,False,"<a href=""http://twitter.com"" rel=""nofollow"">Twitter Web Client</a>"
CarlyFiorina,Coming up shortly on Fox News with Sean Hannity!,Tue Nov 24 02:50:04 +0000 2015,154,28,False,"<a href=""https://about.twitter.com/products/tweetdeck"" rel=""nofollow"">TweetDeck</a>"
CarlyFiorina,We need a President who will see and speak and act on the truth. https://t.co/yePEuWGMG6,Tue Nov 24 01:00:12 +0000 2015,244,95,False,"<a href=""https://about.twitter.com/products/tweetdeck"" rel=""nofollow"">TweetDeck</a>"
CarlyFiorina,Tonight I’m joining Sean Hannity between 10:00-11:00 p.m. ET on Fox News. Tune in!,Mon Nov 23 23:00:27 +0000 2015,169,64,False,"<a href=""https://about.twitter.com/products/tweetdeck"" rel=""nofollow"">TweetDeck</a>"
CarlyFiorina,"Q: How does political correctness harm political discourse? 

Get more answers at https://t.co/sIWIyxiodv.
https://t.co/eiR1SFmaBI",Mon Nov 23 21:43:35 +0000 2015,190,105,False,"<a href=""http://twitter.com"" rel=""nofollow"">Twitter Web Client</a>"
CarlyFiorina,I will make sure that we have the strongest military on the face of the planet and that everyone knows it. https://t.co/yePEuWGMG6,Mon Nov 23 20:00:17 +0000 2015,206,93,False,"<a href=""https://about.twitter.com/products/tweetdeck"" rel=""nofollow"">TweetDeck</a>"
CarlyFiorina,"Q: What is the greatest moral threat facing the United States? 

Get more answers at https://t.co/sIWIyxiodv.
https://t.co/Q9Wd1PLHdj",Mon Nov 23 18:57:35 +0000 2015,165,77,False,"<a href=""http://twitter.com"" rel=""nofollow"">Twitter Web Client</a>"
CarlyFiorina,They are at war with us and all we represent. And so we must wage this war and we must win. https://t.co/yePEuWGMG6,Mon Nov 23 15:00:30 +0000 2015,163,69,False,"<a href=""https://about.twitter.com/products/tweetdeck"" rel=""nofollow"">TweetDeck</a>"
CarlyFiorina,This is a war we must wage and win: https://t.co/yePEuWGMG6,Sat Nov 21 15:00:35 +0000 2015,235,101,False,"<a href=""https://about.twitter.com/products/tweetdeck"" rel=""nofollow"">TweetDeck</a>"
CarlyFiorina,"Conservatives, not party bosses, should pick our nominee. Pitch in just $3 to get Carly on the ballot. https://t.co/3pEdNIzwTK",Sat Nov 21 00:00:19 +0000 2015,95,48,False,"<a href=""https://ads.twitter.com"" rel=""nofollow"">Twitter Ads</a>"
CarlyFiorina,".@mkhammer @MeghanMcCain @megynkelly Strong, conservative women don't need an excuse to drink beer. In. @KatiePavlich @Dloesch",Fri Nov 20 19:29:39 +0000 2015,527,195,False,"<a href=""https://about.twitter.com/products/tweetdeck"" rel=""nofollow"">TweetDeck</a>"
CarlyFiorina,"Conservatives, not party bosses, should pick our nominee. Pitch in just $3 to get Carly on the ballot. https://t.co/glxB1LXKeX",Fri Nov 20 15:16:43 +0000 2015,115,44,False,"<a href=""https://ads.twitter.com"" rel=""nofollow"">Twitter Ads</a>"
CarlyFiorina,"Marian wrote into https://t.co/sIWIyxiodv to ask what I would do to fight ISIS. Here’s my answer:
https://t.co/DngozeH7fe",Thu Nov 19 20:04:26 +0000 2015,261,168,False,"<a href=""http://twitter.com"" rel=""nofollow"">Twitter Web Client</a>"
CarlyFiorina,"Kip from Oregon wrote into https://t.co/sIWIyxiodv and asked why I want to be President. Here’s why:
https://t.co/8h5tZmysMT",Thu Nov 19 18:00:56 +0000 2015,143,90,False,"<a href=""http://twitter.com"" rel=""nofollow"">Twitter Web Client</a>"
CarlyFiorina,"President Obama is speaking in a way that is beneath his office. He is a politician, not a leader.
https://t.co/s8EI5fz3Mk",Thu Nov 19 01:16:49 +0000 2015,886,501,False,"<a href=""http://twitter.com"" rel=""nofollow"">Twitter Web Client</a>"
CarlyFiorina,"We have more IRS agents than FBI and CIA. Does that strike you as a misallocation of resources?
https://t.co/pow3votvBF",Wed Nov 18 19:21:38 +0000 2015,723,558,False,"<a href=""http://twitter.com"" rel=""nofollow"">Twitter Web Client</a>"
CarlyFiorina,"Q: What has President Obama done wrong in the Middle East? 

Get more answers at https://t.co/sIWIyxiodv.
https://t.co/MHOW67KJOQ",Wed Nov 18 15:35:35 +0000 2015,248,142,False,"<a href=""http://twitter.com"" rel=""nofollow"">Twitter Web Client</a>"
CarlyFiorina,This morning I’m joining America’s Newsroom on Fox News around 9:20 a.m. ET. Hope you can watch!,Wed Nov 18 13:30:16 +0000 2015,212,47,False,"<a href=""https://about.twitter.com/products/tweetdeck"" rel=""nofollow"">TweetDeck</a>"
CarlyFiorina,Tonight I'm joining Megyn Kelly on Fox News. Tune in around 9:20 p.m. ET!,Wed Nov 18 01:30:11 +0000 2015,249,79,False,"<a href=""https://about.twitter.com/products/tweetdeck"" rel=""nofollow"">TweetDeck</a>"
CarlyFiorina,"Party bosses want to keep us off the ballot. If you think 2016 should be a choice, not a coronation, pitch in $3. https://t.co/8ivWEyEXso",Wed Nov 18 01:00:10 +0000 2015,84,48,False,"<a href=""https://ads.twitter.com"" rel=""nofollow"">Twitter Ads</a>"
CarlyFiorina,"Q: What do you see when you look around the world today? 

Get more answers at https://t.co/sIWIyxiodv.
https://t.co/DQO3v1jdu8",Tue Nov 17 18:49:17 +0000 2015,197,115,False,"<a href=""http://twitter.com"" rel=""nofollow"">Twitter Web Client</a>"
CarlyFiorina,Party bosses want to keep us off the ballot. Pitch in $3 to help me beat them at their own game. https://t.co/V7RCuKZpO0,Tue Nov 17 14:32:16 +0000 2015,126,58,False,"<a href=""https://ads.twitter.com"" rel=""nofollow"">Twitter Ads</a>"
CarlyFiorina,"Q: What American values would guide you as President? 

Get more answers at https://t.co/sIWIyxiodv.
https://t.co/8kgTGr6Cn1",Tue Nov 17 00:52:35 +0000 2015,300,137,False,"<a href=""http://twitter.com"" rel=""nofollow"">Twitter Web Client</a>"
CarlyFiorina,"Q: What will you do about ISIS? 

Get more answers at https://t.co/sIWIyxiodv.
https://t.co/9Y8ilnMddg",Mon Nov 16 19:32:22 +0000 2015,361,206,False,"<a href=""http://twitter.com"" rel=""nofollow"">Twitter Web Client</a>"
CarlyFiorina,"No, Mrs. Clinton, no, President Obama: climate change is not our most pressing national security challenge.
https://t.co/jf93FziQzu",Sun Nov 15 22:37:39 +0000 2015,1829,1069,False,"<a href=""http://twitter.com"" rel=""nofollow"">Twitter Web Client</a>"
CarlyFiorina,We need a President who will see and speak and act on the truth...Hillary Clinton will not call this Islamic terrorism. I will.,Sun Nov 15 02:44:12 +0000 2015,1862,734,False,"<a href=""http://twitter.com/download/iphone"" rel=""nofollow"">Twitter for iPhone</a>"
CarlyFiorina,"Like all of you, I am angry. I am heartsick and heartbroken at the carnage in Paris. https://t.co/6WqQ764xJE",Sat Nov 14 22:15:24 +0000 2015,858,295,False,"<a href=""http://twitter.com/download/iphone"" rel=""nofollow"">Twitter for iPhone</a>"
CarlyFiorina,I mourn with you. I pray with you. I stand with you. America must lead in the world. We must wage &amp win this fight against Islamic terrorism,Sat Nov 14 03:13:42 +0000 2015,3531,1528,False,"<a href=""http://twitter.com/download/iphone"" rel=""nofollow"">Twitter for iPhone</a>"
CarlyFiorina,"Q: Why do we need a leader from outside of the political class? 

Get more answers at https://t.co/sIWIyxiodv.
https://t.co/Ze9JILKpwG",Fri Nov 13 20:15:39 +0000 2015,231,130,False,"<a href=""http://twitter.com"" rel=""nofollow"">Twitter Web Client</a>"
CarlyFiorina,Tonight I'm joining @seanhannity on Fox News. Hope you can tune in!,Fri Nov 13 03:00:52 +0000 2015,234,50,False,"<a href=""http://twitter.com/download/iphone"" rel=""nofollow"">Twitter for iPhone</a>"
CarlyFiorina,"Donald, sorry, I've got to interrupt again. https://t.co/zofyRuHGvX",Fri Nov 13 02:20:31 +0000 2015,726,435,False,"<a href=""http://twitter.com/download/iphone"" rel=""nofollow"">Twitter for iPhone</a>"
CarlyFiorina,It's time to take our government back. https://t.co/vbIZ5oT37q,Thu Nov 12 20:25:48 +0000 2015,250,98,False,"<a href=""https://about.twitter.com/products/tweetdeck"" rel=""nofollow"">TweetDeck</a>"
CarlyFiorina,RT @DanaTheBlaze: .@CarlyFiorina joins #Dailydana at 6pm ET on @TheBlaze TV. Check local listings or go to https://t.co/NTeHxzWF7C,Thu Nov 12 18:35:35 +0000 2015,0,21,False,"<a href=""https://about.twitter.com/products/tweetdeck"" rel=""nofollow"">TweetDeck</a>"
CarlyFiorina,"Q: Are voters ready for someone from outside the political class? 

Get more answers at https://t.co/sIWIyxiodv.
https://t.co/0wwAvaPyLc",Thu Nov 12 15:26:01 +0000 2015,172,72,False,"<a href=""http://twitter.com"" rel=""nofollow"">Twitter Web Client</a>"
CarlyFiorina,"Thank you to all our veterans for your service and sacrifice.
https://t.co/eR16DWvdWY",Wed Nov 11 23:26:37 +0000 2015,530,155,False,"<a href=""http://twitter.com"" rel=""nofollow"">Twitter Web Client</a>"
CarlyFiorina,"Carly can beat Hillary Clinton. Pitch in $3 to make that happen. https://t.co/EMzAnAH5Xf
https://t.co/slskGaLOXi",Wed Nov 11 19:02:50 +0000 2015,301,123,False,"<a href=""http://twitter.com"" rel=""nofollow"">Twitter Web Client</a>"
CarlyFiorina,ObamaCare crushes families. Pitch in $3 to help Carly fight for free market solutions. https://t.co/o4aI9D1urI,Wed Nov 11 04:20:56 +0000 2015,228,63,False,"<a href=""https://ads.twitter.com"" rel=""nofollow"">Twitter Ads</a>"
CarlyFiorina,I will get America back in the leadership business. https://t.co/aTz6TIncVg,Wed Nov 11 03:35:04 +0000 2015,400,129,False,"<a href=""https://about.twitter.com/products/tweetdeck"" rel=""nofollow"">TweetDeck</a>"
CarlyFiorina,"ObamaCare crushes families. Pitch in $3 to help Carly fight for free market solutions. https://t.co/DeUDwmoTlC
https://t.co/NBuKUVqGBW",Wed Nov 11 03:31:45 +0000 2015,721,285,False,"<a href=""http://twitter.com"" rel=""nofollow"">Twitter Web Client</a>"
CarlyFiorina,"Our problems won’t be solved just by replacing a D with an R. Chip in $3 to elect Carly. https://t.co/thtn75YDlx
https://t.co/Usol0fSJwZ",Wed Nov 11 02:57:49 +0000 2015,311,112,False,"<a href=""http://twitter.com"" rel=""nofollow"">Twitter Web Client</a>"
CarlyFiorina,"I am a cancer survivor. As President, I will repeal Obamacare and ensure quality, affordable healthcare for all. https://t.co/2i3lMw1nfd",Wed Nov 11 02:49:50 +0000 2015,674,224,False,"<a href=""https://about.twitter.com/products/tweetdeck"" rel=""nofollow"">TweetDeck</a>"
CarlyFiorina,"The political class responds to pressure, and together, we will take back our government. https://t.co/HaJbirWUpE",Wed Nov 11 02:42:06 +0000 2015,190,73,False,"<a href=""https://about.twitter.com/products/tweetdeck"" rel=""nofollow"">TweetDeck</a>"
CarlyFiorina,I will shrink the size of the federal government. Here’s how: https://t.co/DP0w0zQicS,Wed Nov 11 02:39:51 +0000 2015,202,84,False,"<a href=""https://about.twitter.com/products/tweetdeck"" rel=""nofollow"">TweetDeck</a>"
CarlyFiorina,"As President, I will sign the REINS Act. Here’s why: https://t.co/hB0pXRNNO6",Wed Nov 11 02:36:59 +0000 2015,150,67,False,"<a href=""https://about.twitter.com/products/tweetdeck"" rel=""nofollow"">TweetDeck</a>"
CarlyFiorina,I support zero-based budgeting. Here’s why: https://t.co/FaPXEIJ7KQ,Wed Nov 11 02:31:56 +0000 2015,237,114,False,"<a href=""https://about.twitter.com/products/tweetdeck"" rel=""nofollow"">TweetDeck</a>"
CarlyFiorina,Want to see what a 3-pg tax code could look like? https://t.co/BIkyhmjUvj,Wed Nov 11 02:26:22 +0000 2015,281,190,False,"<a href=""https://about.twitter.com/products/tweetdeck"" rel=""nofollow"">TweetDeck</a>"
CarlyFiorina,"Q: What is the impact of our big government on everyday Americans? 

Get more answers at https://t.co/sIWIyxiodv.
https://t.co/CHhCoX5WJo",Tue Nov 10 23:32:18 +0000 2015,119,58,False,"<a href=""http://twitter.com"" rel=""nofollow"">Twitter Web Client</a>"
CarlyFiorina,"Q: What is at stake during this election? 

Get more answers at https://t.co/sIWIyxiodv.
https://t.co/EVHKiPe2iq",Tue Nov 10 22:36:30 +0000 2015,126,52,False,"<a href=""http://twitter.com"" rel=""nofollow"">Twitter Web Client</a>"
CarlyFiorina,Cheer Carly on in the Republican presidential debate. Watch TONIGHT at 9pm ET on Fox Business. https://t.co/eoleMkItNE,Tue Nov 10 19:22:56 +0000 2015,402,136,False,"<a href=""https://about.twitter.com/products/tweetdeck"" rel=""nofollow"">TweetDeck</a>"
CarlyFiorina,"Q: What is your reaction to the November jobs report?

Get more answers at https://t.co/sIWIyxiodv.
https://t.co/2XEsFA4aP3",Tue Nov 10 15:34:48 +0000 2015,93,53,False,"<a href=""http://twitter.com"" rel=""nofollow"">Twitter Web Client</a>"
CarlyFiorina,"What makes a true leader?
https://t.co/u4EyMDhi9f",Mon Nov 09 19:41:46 +0000 2015,242,138,False,"<a href=""http://twitter.com"" rel=""nofollow"">Twitter Web Client</a>"
CarlyFiorina,Ready to cheer Carly on in the next debate? Watch on Fox Business or https://t.co/TJil8lJ2r1 tomorrow at 9pm ET. https://t.co/D1QxdrHOFZ,Mon Nov 09 18:01:36 +0000 2015,222,82,False,"<a href=""https://about.twitter.com/products/tweetdeck"" rel=""nofollow"">TweetDeck</a>"
CarlyFiorina,"Q: Why is it so hard to enact real change in Washington? 

Get more answers at https://t.co/sIWIyxiodv.
https://t.co/KYrNwTzSwQ",Mon Nov 09 15:19:52 +0000 2015,192,110,False,"<a href=""http://twitter.com"" rel=""nofollow"">Twitter Web Client</a>"
CarlyFiorina,"Q: Would you have approved the Keystone XL Pipeline? 

Get more answers at https://t.co/sIWIyxiodv .
https://t.co/CfPUEd1K5H",Sun Nov 08 19:29:02 +0000 2015,152,92,False,"<a href=""http://twitter.com"" rel=""nofollow"">Twitter Web Client</a>"
CarlyFiorina,My interview with Meet the Press airs tomorrow on NBC. Check your local listings and tune in!,Sun Nov 08 01:00:13 +0000 2015,243,63,False,"<a href=""https://about.twitter.com/products/tweetdeck"" rel=""nofollow"">TweetDeck</a>"
CarlyFiorina,"Q: How will you contrast yourself with Hillary Clinton?
 
Get more answers at https://t.co/sIWIyxiodv.
https://t.co/FXTT7KDVrm",Sat Nov 07 17:21:32 +0000 2015,347,185,False,"<a href=""http://twitter.com"" rel=""nofollow"">Twitter Web Client</a>"
CarlyFiorina,I'm joining The Kelly File tonight on Fox News. Hope you'll watch between 9:00-10:00 ET!,Fri Nov 06 23:30:17 +0000 2015,261,69,False,"<a href=""https://about.twitter.com/products/tweetdeck"" rel=""nofollow"">TweetDeck</a>"
CarlyFiorina,"Q: Would you have approved the Keystone XL Pipeline? 

Get more answers at https://t.co/sIWIyxiodv.
https://t.co/lb0K5sr4Gy",Fri Nov 06 20:36:21 +0000 2015,190,101,False,"<a href=""http://twitter.com"" rel=""nofollow"">Twitter Web Client</a>"
CarlyFiorina,"Q: How will you simplify the tax code?

Get more answers at https://t.co/sIWIyxiodv.
https://t.co/yS6O0W2DRh",Fri Nov 06 14:53:20 +0000 2015,146,82,False,"<a href=""http://twitter.com"" rel=""nofollow"">Twitter Web Client</a>"
CarlyFiorina,Tonight I'm joining @seanhannity on Fox News. Hope you can tune in! https://t.co/VUHR7rUpT3 https://t.co/5hWSWmHyqU,Fri Nov 06 01:45:55 +0000 2015,198,68,False,"<a href=""https://about.twitter.com/products/tweetdeck"" rel=""nofollow"">TweetDeck</a>"
CarlyFiorina,"Q: How will you secure the border?

Get more answers at https://t.co/sIWIyxiodv.
https://t.co/Ua9qS0TYJC",Fri Nov 06 01:19:38 +0000 2015,226,97,False,"<a href=""http://twitter.com"" rel=""nofollow"">Twitter Web Client</a>"
CarlyFiorina,"Q: How will you simplify the tax code?

Get more answers at https://t.co/sIWIyxiodv.
https://t.co/RZNMjXL2Tv",Thu Nov 05 21:13:48 +0000 2015,134,74,False,"<a href=""http://twitter.com"" rel=""nofollow"">Twitter Web Client</a>"
CarlyFiorina,"Thankful to have so many supporters welcome me as I filed for the New Hampshire primary today! #Carly2016
https://t.co/w9SQc5Xiie",Thu Nov 05 19:13:40 +0000 2015,273,92,False,"<a href=""http://twitter.com"" rel=""nofollow"">Twitter Web Client</a>"
CarlyFiorina,"RT @kailanikm: Carly Fiorina files for the NH primary. Says ""let's take our government back!"" #nhpolitics #FITN https://t.co/Xz3RbJhlHO",Thu Nov 05 17:38:22 +0000 2015,0,69,False,"<a href=""https://about.twitter.com/products/tweetdeck"" rel=""nofollow"">TweetDeck</a>"
CarlyFiorina,"Q: How do you define feminism?

Get more answers at https://t.co/sIWIyxiodv.
https://t.co/lwID6VmHpZ",Thu Nov 05 01:14:51 +0000 2015,404,211,False,"<a href=""http://twitter.com"" rel=""nofollow"">Twitter Web Client</a>"
CarlyFiorina,"Q: How would you address Russia's entrance into the Syrian crisis?

Get more answers at https://t.co/sIWIyxiodv.
https://t.co/ykCHbdXWDK",Wed Nov 04 20:16:39 +0000 2015,130,79,False,"<a href=""http://twitter.com"" rel=""nofollow"">Twitter Web Client</a>"
CarlyFiorina,"Q: How has your experience prepared you to be President?

Get more answers at https://t.co/sIWIyxiodv.
https://t.co/zaHRJLEcLV",Wed Nov 04 15:46:44 +0000 2015,129,71,False,"<a href=""http://twitter.com"" rel=""nofollow"">Twitter Web Client</a>"
CarlyFiorina,Want to be my personal guest at Tuesday’s presidential debate? Enter now: https://t.co/QcZYPX40th,Wed Nov 04 00:30:09 +0000 2015,81,44,False,"<a href=""https://ads.twitter.com"" rel=""nofollow"">Twitter Ads</a>"
CarlyFiorina,The liberal women of The View attacked my looks and smile. Here’s my response: https://t.co/XvrPqcc9vH,Tue Nov 03 19:22:40 +0000 2015,501,230,False,"<a href=""https://ads.twitter.com"" rel=""nofollow"">Twitter Ads</a>"
CarlyFiorina,"Q: What do you think about Obama's plan to send 50 special forces operators into Syria?
https://t.co/5Jbijhbeff",Tue Nov 03 17:58:33 +0000 2015,142,93,False,"<a href=""http://twitter.com"" rel=""nofollow"">Twitter Web Client</a>"
CarlyFiorina,"If liberals want a debate, let’s debate the issues—without personal attacks and name-calling.
https://t.co/l3RZqSPRzO",Tue Nov 03 14:59:27 +0000 2015,471,208,False,"<a href=""http://twitter.com"" rel=""nofollow"">Twitter Web Client</a>"
CarlyFiorina,"Flashback to the last time I was on The View. It’s even more true today:
https://t.co/SvXT1o0pfr",Tue Nov 03 02:12:39 +0000 2015,537,190,False,"<a href=""http://twitter.com"" rel=""nofollow"">Twitter Web Client</a>"
CarlyFiorina,"How heavy is our bag? Make your guess, win my flag pin: https://t.co/FvoxYFDqkW",Mon Nov 02 21:46:19 +0000 2015,42,29,False,"<a href=""https://ads.twitter.com"" rel=""nofollow"">Twitter Ads</a>"
CarlyFiorina,"Q: What are you going to do to reduce our national debt?
 
Get more answers at https://t.co/sIWIyxiodv.
https://t.co/KzH6G2Pe4C",Mon Nov 02 18:41:43 +0000 2015,194,107,False,"<a href=""http://twitter.com"" rel=""nofollow"">Twitter Web Client</a>"
CarlyFiorina,"I'm with @glennbeck. What do you say, @Reince? Let's have a conservative network host a debate! https://t.co/wuyXONqg4S",Mon Nov 02 17:33:52 +0000 2015,752,431,False,"<a href=""https://about.twitter.com/products/tweetdeck"" rel=""nofollow"">TweetDeck</a>"
CarlyFiorina,"If liberals want a debate, let’s debate the issues—without personal attacks and name-calling.
https://t.co/gouC27Dwdl",Mon Nov 02 16:42:17 +0000 2015,535,238,False,"<a href=""http://twitter.com"" rel=""nofollow"">Twitter Web Client</a>"
CarlyFiorina,"I’ll debate any one, any time, any place. And how about letting some conservative networks host debates as well? Cc: @oann @theblaze",Mon Nov 02 14:02:53 +0000 2015,726,323,False,"<a href=""https://about.twitter.com/products/tweetdeck"" rel=""nofollow"">TweetDeck</a>"
CarlyFiorina,I'm coming up shortly on Fox &amp Friends. Tune into Fox News if you can! https://t.co/VUHR7rCOut,Mon Nov 02 13:00:33 +0000 2015,155,40,False,"<a href=""https://about.twitter.com/products/tweetdeck"" rel=""nofollow"">TweetDeck</a>"
LindseyGrahamSC,https://t.co/Ld1sN4KS1R,Mon Dec 21 16:31:53 +0000 2015,72,44,False,"<a href=""http://sidewire.com/"" rel=""nofollow"">Sidewire</a>"
LindseyGrahamSC,"Thank you to everyone who honored me with their support. God bless our fighting men and women &amp God bless America.
 https://t.co/9qCM2qIu8p",Mon Dec 21 14:38:21 +0000 2015,470,353,False,"<a href=""https://about.twitter.com/products/tweetdeck"" rel=""nofollow"">TweetDeck</a>"
